8.59143E+17,5/1/2017 20:30,"#ICYMI- On Saturday I signed two EO's to help keep jobs &amp; wealth in our country.
EO1: https://t.co/XJggnJAiPi 
EO2:… https://t.co/2iEten4SVl"
8.59128E+17,5/1/2017 19:29,This month we celebrate the contributions of Asian Americans &amp; Pacific Islanders that enrich our Nation. https://t.co/rEJi9ahOaY
8.5866E+17,4/30/2017 12:32,...healthcare plan is on its way. Will have much lower premiums &amp; deductibles while at the same time taking care of pre-existing conditions!
8.58659E+17,4/30/2017 12:28,You can't compare anything to ObamaCare because ObamaCare is dead. Dems want billions to go to Insurance Companies to bail out donors....New
8.58654E+17,4/30/2017 12:09,"The Democrats, without a leader, have become the party of obstruction.They are only interested in themselves and not in what's best for U.S."
8.58654E+17,4/30/2017 12:05,Big excitement last night in the Great State of Pennsylvania! Fantastic crowd and people. MAKE AMERICA GREAT AGAIN!
8.58645E+17,4/30/2017 11:33,I will be interviewed on @FaceTheNation this morning at 10:00 A.M. Have a great day!
8.58376E+17,4/29/2017 17:42,"RT @charliekirk11: 100 days ago a new message, leader, &amp; movement took the Oval Office! A government FOR the people BY the people. This is…"
8.58375E+17,4/29/2017 17:39,"Mainstream (FAKE) media refuses to state our long list of achievements, including 28 legislative signings, strong borders &amp; great optimism!"
8.58344E+17,4/29/2017 15:35,"Looking forward to RALLY in the Great State of Pennsylvania tonight at 7:30. Big crowd, big energy!"
8.58149E+17,4/29/2017 2:40,".@LouDobbs just stated that ""President Trump's successes are unmatched in recent presidential history""  Thank you Lou!"
8.581E+17,4/28/2017 23:26,"North Korea disrespected the wishes of China &amp; its highly respected President when it launched, though unsuccessfully, a missile today. Bad!"
8.58086E+17,4/28/2017 22:31,I will be interviewed by @MarthaMaccallum on @FoxNews tonight at 7pm. Enjoy!
8.57931E+17,4/28/2017 12:15,"We are making tremendous progress with the V. A. There has never been so much done so quickly, and we have just started. We love our VETS!"
8.5793E+17,4/28/2017 12:12,"RT @foxandfriends: Former President Obama's $400K Wall Street speech stuns liberal base; Sen. Warren saying she ""was troubled by that"" http…"
8.57727E+17,4/27/2017 22:43,"Today, I signed an Executive Order on Improving Accountability and Whistleblower Protection at the @DeptVetAffairs:… https://t.co/UQ6VNCyhlj"
8.57712E+17,4/27/2017 21:42,"Presidential Memorandum for the @CommerceGov, @SecretaryRoss re: Aluminum Imports and Threats to National Security:… https://t.co/GnKoVz9GTO"
8.57671E+17,4/27/2017 18:59,.@FLOTUS Melania and I were honored to welcome Argentina President @MauricioMacri and First Lady Juliana Awada to t… https://t.co/gR3EPznu1H
8.57605E+17,4/27/2017 14:39,As families prepare for summer vacations in our National Parks - Democrats threaten to close them and shut down the government. Terrible!
8.57605E+17,4/27/2017 14:39,Democrats used to support border security — now they want illegals to pour through our borders.
8.57605E+17,4/27/2017 14:38,Democrats jeopardizing the safety of our troops to bail out their donors from insurance companies. It is time to put #AmericaFirst🇺🇸
8.57605E+17,4/27/2017 14:37,What's more important? Rebuilding our military - or bailing out insurance companies? Ask the Democrats.
8.57605E+17,4/27/2017 14:37,I promise to rebuild our military and secure our border. Democrats want to shut down the government. Politics!
8.57605E+17,4/27/2017 14:37,I want to help our miners while the Democrats are blocking their healthcare.
8.57558E+17,4/27/2017 11:30,The Democrats want to shut government if we don't bail out Puerto Rico and give billions to their insurance companies for OCare failure. NO!
8.57555E+17,4/27/2017 11:21,"...subject to the fact that if we do not reach a fair deal for all, we will then terminate NAFTA. Relationships are good-deal very possible!"
8.57553E+17,4/27/2017 11:12,I received calls from the President of Mexico and the Prime Minister of Canada asking to renegotiate NAFTA rather than terminate. I agreed..
8.5737E+17,4/26/2017 23:06,"Democrats are trying to bail out insurance companies from disastrous #ObamaCare, and Puerto Rico with your tax dollars. Sad!"
8.57361E+17,4/26/2017 22:27,"A great great honor to welcome &amp; recognize the National Teacher of the Year, as well as the Teacher of the Year fro… https://t.co/pUGl7RDoVX"
8.57336E+17,4/26/2017 20:49,"Today, I signed an Executive Order on Enforcing Statutory Prohibitions on Federal Control of Education. EO:… https://t.co/YYafFQncbC"
8.57296E+17,4/26/2017 18:10,"Today, I signed an Executive Order @ the U.S. Dept. of @Interior: 'Review of Designations Under the Antiquities Act… https://t.co/Eq6JDzMqTY"
8.57246E+17,4/26/2017 14:53,"HAPPY BIRTHDAY to our @FLOTUS, Melania! 
https://t.co/rYYp51mxDQ https://t.co/np7KYHglSv"
8.57185E+17,4/26/2017 10:51,The U.S. recorded its slowest economic growth in five years (2016). GDP up only 1.6%. Trade deficits hurt the economy very badly.
8.57182E+17,4/26/2017 10:38,"...the Ninth Circuit, which has a terrible record of being overturned (close to 80%). They used to call this ""judge shopping!"" Messy system."
8.5718E+17,4/26/2017 10:30,"Out of our very big country, with many choices, does everyone notice that both the ""ban"" case and now the ""sanctuary"" case is brought in ..."
8.57177E+17,4/26/2017 10:20,First the Ninth Circuit rules against the ban &amp; now it hits again on sanctuary cities-both ridiculous rulings. See you in the Supreme Court!
8.57014E+17,4/25/2017 23:32,"'Presidential Executive Order on Promoting Agriculture and Rural Prosperity in America'
Executive Order:… https://t.co/LVMjZ9Ax0U"
8.56929E+17,4/25/2017 17:51,"Remarks at the United States Holocaust Memorial Museum's National Days of Remembrance. 
Full remarks:… https://t.co/BJbI6ZtGo7"
8.56849E+17,4/25/2017 12:36,"Don't let the fake media tell you that I have changed my position on the WALL. It will get built and help stop drugs, human trafficking etc."
8.56848E+17,4/25/2017 12:30,Canada has made business for our dairy farmers in Wisconsin and other border states very difficult. We will not stand for this. Watch!
8.56831E+17,4/25/2017 11:23,Proud of @IvankaTrump for her leadership on these important issues. Looking forward to hearing her speak at the W20! https://t.co/e6Uajrm8zp
8.56607E+17,4/24/2017 20:32,"Today, I signed the Holocaust Remembrance Proclamation: https://t.co/762SqgdLMV #ICYMI- My statement last night at… https://t.co/vrqqFDi8En"
8.56558E+17,4/24/2017 17:18,"If our healthcare plan is approved, you will see real healthcare and premiums will start tumbling down. ObamaCare is in a death spiral!"
8.56556E+17,4/24/2017 17:11,Join me in congratulating @NASA's @AstroPeggy by using the hashtag #CongratsPeggy! Earlier today:… https://t.co/AUdJgxXiT4
8.56531E+17,4/24/2017 15:31,"....the wall is not built, which it will be, the drug situation will NEVER be fixed the way it should be!
#BuildTheWall"
8.56485E+17,4/24/2017 12:28,The Wall is a very important tool in stopping drugs from pouring into our country and poisoning our youth (and many others)! If
8.56482E+17,4/24/2017 12:15,"The two fake news polls released yesterday, ABC &amp; NBC, while containing some very positive info, were totally wrong in General E. Watch!"
8.56235E+17,4/23/2017 19:55,...popular vote. ABC News/Washington Post Poll (wrong big on election) said almost all stand by their vote on me &amp; 53% said strong leader.
8.56233E+17,4/23/2017 19:48,New polls out today are very good considering that much of the media is FAKE and almost always negative. Would still beat Hillary in .....
8.56172E+17,4/23/2017 15:44,"Eventually, but at a later date so we can get started early, Mexico will be paying, in some form, for the badly needed border wall."
8.56171E+17,4/23/2017 15:42,The Democrats don't want money from budget going to border wall despite the fact that it will stop drugs and very bad MS 13 gang members.
8.56151E+17,4/23/2017 14:20,ObamaCare is in serious trouble. The Dems need big money to keep it going - otherwise it dies far sooner than anyone would have thought.
8.56148E+17,4/23/2017 14:07,"Thank you Lake Worth, Florida. @foxandfriends"
8.56147E+17,4/23/2017 14:05,Very interesting election currently taking place in France.
8.55901E+17,4/22/2017 21:49,I am committed to keeping our air and water clean but always remember that economic growth enhances environmental protection. Jobs matter!
8.55859E+17,4/22/2017 19:01,"Today on Earth Day, we celebrate our beautiful forests, lakes and land. We stand committed to preserving the natural beauty of our nation."
8.55817E+17,4/22/2017 16:15,Big TAX REFORM AND TAX REDUCTION will be announced next Wednesday.
8.55816E+17,4/22/2017 16:10,Next Saturday night I will be holding a BIG rally in Pennsylvania. Look forward to it!
8.55815E+17,4/22/2017 16:05,Getting ready to visit Walter Reed Medical Center with Melania. Looking forward to seeing our bravest and greatest Americans!
8.55803E+17,4/22/2017 15:18,RT @foxandfriends: Israeli PM Netanyahu praises U.S. policy changes during meeting with Defense. Sec Mattis https://t.co/v2C9oaq3uY
8.55803E+17,4/22/2017 15:18,"RT @foxandfriends: Chicago approves new plan to hide illegal immigrants from the feds, plus give them access to city services https://t.co/…"
8.55627E+17,4/22/2017 3:38,"After 5 SB victories since 2002, it was my honor to give Bob Kraft, Coach Belichick, and the players their first to… https://t.co/UZPKjqoGZY"
8.55583E+17,4/22/2017 0:43,"'Presidential Executive Order on Identifying and Reducing Tax Regulatory Burdens' 
Executive Order:… https://t.co/dpE6hDzlAt"
8.55577E+17,4/22/2017 0:19,"RT @Scavino45: .@POTUS @realDonaldTrump, @IvankaTrump, Jared Kushner, &amp; Dina Powell in the Oval Office today w/ Aya &amp; her brother Basel.
#W…"
8.55517E+17,4/21/2017 20:22,"WELCOME HOME, AYA!
#GodBlessTheUSA🇺🇸 https://t.co/CR4I8dvunc"
8.55407E+17,4/21/2017 13:04,"China is very much the economic lifeline to North Korea so, while nothing is easy, if they want to solve the North Korean problem, they will"
8.55373E+17,4/21/2017 10:50,"No matter how much I accomplish during the ridiculous standard of the first 100 days, &amp; it has been a lot (including S.C.), media will kill!"
8.55369E+17,4/21/2017 10:32,Another terrorist attack in Paris. The people of France will not take much more of this. Will have a big effect on presidential election!
8.55363E+17,4/21/2017 10:11,RT @foxandfriends: NYT editor apologizes for misleading tweet about New England Patriots' visit to the White House (via @FoxFriendsFirst) h…
8.55173E+17,4/20/2017 21:35,A great honor to host PM Paolo Gentiloni of Italy at the White House this afternoon! #ICYMI- Joint Press Conference… https://t.co/lJAvEZJV1F
8.55142E+17,4/20/2017 19:33,"We're going to use American steel, we're going to use American labor, we are going to come first in all deals. ➡️… https://t.co/QYjWx9K4YY"
8.55056E+17,4/20/2017 13:48,"Failing @nytimes, which has been calling me wrong for two years, just got caught in a big lie concerning New England Patriots visit to W.H."
8.54871E+17,4/20/2017 1:34,A great honor to host the @SuperBowl Champion New England @Patriots at the White House today. Congratulations!… https://t.co/tQ5XEPaIxn
8.54793E+17,4/19/2017 20:26,"Today I signed the Veterans (OUR HEROES) Choice Program Extension &amp; Improvement Act @ the @WhiteHouse. #S544 
Watch… https://t.co/0sMv4sPrmf"
8.54749E+17,4/19/2017 17:31,#BuyAmericanHireAmerican🇺🇸 https://t.co/JPEXQTVR1E
8.54677E+17,4/19/2017 12:43,Dems failed in Kansas and are now failing in Georgia. Great job Karen Handel! It is now Hollywood vs. Georgia on June 20th.
8.54547E+17,4/19/2017 4:09,"Despite major outside money, FAKE media support and eleven Republican candidates, BIG ""R"" win with runoff in Georgia. Glad to be of help!"
8.54438E+17,4/18/2017 20:56,"#BuyAmericanHireAmerican🇺🇸
Watch➡️https://t.co/AUqYcrgeyn https://t.co/rf9aivVb7g"
8.54434E+17,4/18/2017 20:38,"Just learned that Jon @Ossoff, who is running for Congress in Georgia, doesn't even live in the district. Republicans, get out and vote!"
8.54285E+17,4/18/2017 10:46,Republicans must get out today and VOTE in Georgia 6. Force runoff and easy win! Dem Ossoff will raise your taxes-very bad on crime &amp; 2nd A.
8.54283E+17,4/18/2017 10:38,"Democrat Jon Ossoff would be a disaster in Congress. VERY weak on crime and illegal immigration, bad for jobs and wants higher taxes. Say NO"
8.5427E+17,4/18/2017 9:48,I will be interviewed on @foxandfriends by @ainsleyearhardt starting at 6:00 A.M. Enjoy!
8.54268E+17,4/18/2017 9:39,The weak illegal immigration policies of the Obama Admin. allowed bad MS 13 gangs to form in cities across U.S. We are removing them fast!
8.54157E+17,4/18/2017 2:18,"With eleven Republican candidates running in Georgia (on Tuesday) for Congress, a runoff will be a win. Vote ""R"" for lower taxes &amp; safety!"
8.54103E+17,4/17/2017 22:41,"See you tomorrow Wisconsin!

'Trump spurs small-business optimism in Milwaukee area'
https://t.co/JUxhO3oqjO"
8.54102E+17,4/17/2017 22:38,"TRUMP APPROVAL HITS 50%
https://t.co/vjZkGTyQb9"
8.53965E+17,4/17/2017 13:35,RT @DRUDGE_REPORT: TRUMP APPROVAL HITS 50% https://t.co/TruX3WzR3U
8.53964E+17,4/17/2017 13:31,"The super Liberal Democrat in the Georgia Congressioal race tomorrow wants to protect criminals, allow illegal immigration and raise taxes!"
8.53946E+17,4/17/2017 12:17,The Fake Media (not Real Media) has gotten even worse since the election. Every story is badly slanted. We have to hold them to the truth!
8.53944E+17,4/17/2017 12:13,"A great book for your reading enjoyment: ""REASONS TO VOTE FOR DEMOCRATS"" by Michael J. Knowles."
8.53943E+17,4/17/2017 12:07,"""The first 90 days of my presidency has exposed the total failure of the last eight years of foreign policy!"" So true. @foxandfriends"
8.53771E+17,4/17/2017 0:45,"The recent Kansas election (Congress) was a really big media event, until the Republicans won. Now they play the same game with Georgia-BAD!"
8.53604E+17,4/16/2017 13:41,"Our military is building and is rapidly becoming stronger than ever before. Frankly, we have no choice!"
8.53597E+17,4/16/2017 13:13,Someone should look into who paid for the small organized rallies yesterday. The election is over!
8.53596E+17,4/16/2017 13:07,I did what was an almost an impossible thing to do for a Republican-easily won the Electoral College! Now Tax Returns are brought up again?
8.53585E+17,4/16/2017 12:24,Happy Easter to everyone!
8.53583E+17,4/16/2017 12:18,Why would I call China a currency manipulator when they are working with us on the North Korean problem? We will see what happens!
8.53001E+17,4/14/2017 21:46,RT @FLOTUS: Looking forward to hosting the annual Easter Egg Roll at the @WhiteHouse on Monday! https://t.co/nz7vucugx9
8.52985E+17,4/14/2017 20:41,Weekly Address- https://t.co/tpZ7eqJLUH https://t.co/B2NQzj53ft
8.52723E+17,4/14/2017 3:18,RT @DRUDGE_REPORT: GREAT AGAIN: FEDS ARREST MURDER SUSPECT IN 'FAST AND FURIOUS' SCANDAL... https://t.co/clOLxTE3D4
8.52603E+17,4/13/2017 19:21,It was a great honor to welcome Atlanta's heroic first responders to the White House this afternoon! https://t.co/ZtC14AJ0xs
8.52511E+17,4/13/2017 13:16,Things will work out fine between the U.S.A. and Russia. At the right time everyone will come to their senses &amp; there will be lasting peace!
8.52509E+17,4/13/2017 13:08,"I have great confidence that China will properly deal with North Korea. If they are unable to do so, the U.S., with its allies, will! U.S.A."
8.52319E+17,4/13/2017 0:32,"Jobs are returning, illegal immigration is plummeting, law, order and justice are being restored. We are truly making America great again!"
8.52298E+17,4/12/2017 23:10,"One by one we are keeping our promises - on the border, on energy, on jobs, on regulations. Big changes are happening!"
8.52298E+17,4/12/2017 23:09,Economic confidence is soaring as we unleash the power of private sector job creation and stand up for the American Workers. #AmericaFirst
8.52277E+17,4/12/2017 21:48,Great meeting w/ NATO Sec. Gen. We agreed on the importance of getting countries to pay their fair share &amp; focus on… https://t.co/G9TdjWezmH
8.52139E+17,4/12/2017 12:37,"Great win in Kansas last night for Ron Estes, easily winning the Congressional race against the Dems, who spent heavily &amp; predicted victory!"
8.52135E+17,4/12/2017 12:22,Had a very good call last night with the President of China concerning the menace of North Korea.
8.51997E+17,4/12/2017 3:16,I will be interviewed by @MariaBartiromo at 6:00 A.M. @FoxBusiness. Enjoy!
8.51895E+17,4/11/2017 20:27,Great Strategic &amp; Policy CEO Forum today with my Cabinet Secretaries and top CEO's from around the United States.… https://t.co/pmGIL08OpP
8.51782E+17,4/11/2017 12:59,"Ron Estes is running TODAY for Congress in the Great State of Kansas. A wonderful guy, I need his help on Healthcare &amp; Tax Cuts (Reform)."
8.51768E+17,4/11/2017 12:03,"North Korea is looking for trouble. If China decides to help, that would be great. If not, we will solve the problem without them!  U.S.A."
8.51767E+17,4/11/2017 11:59,I explained to the President of China that a trade deal with the U.S. will be far better for them if they solve the North Korean problem!
8.51585E+17,4/10/2017 23:56,"Happy Passover to everyone celebrating in the United States of America, Israel, and around the world. #ChagSameach"
8.51555E+17,4/10/2017 21:59,Congratulations to Justice Neil Gorsuch on his elevation to the United States Supreme Court. A great day for Americ… https://t.co/RM9lfTaePS
8.51247E+17,4/10/2017 1:35,Thank you @USNavy! #USA https://t.co/oD7L8vPgjq
8.51093E+17,4/9/2017 15:21,...confidence that President Al Sisi will handle situation properly.
8.51093E+17,4/9/2017 15:20,So sad to hear of the terrorist attack in Egypt. U.S. strongly condemns. I have great...
8.508E+17,4/8/2017 19:58,Judge Gorsuch will be sworn in at the Rose Garden of the White House on Monday at 11:00 A.M. He will be a great Justice. Very proud of him!
8.50785E+17,4/8/2017 19:00,The reason you don't generally hit runways is that they are easy and inexpensive to quickly fix (fill in and top)!
8.50724E+17,4/8/2017 14:54,"Congratulations to our great military men and women for representing the United States, and the world, so well in the Syria attack."
8.50723E+17,4/8/2017 14:51,"...goodwill and friendship was formed, but only time will tell on trade."
8.50723E+17,4/8/2017 14:50,It was a great honor to have President Xi Jinping and Madame Peng Liyuan of China as our guests in the United States. Tremendous...
8.50489E+17,4/7/2017 23:22,RT @IvankaTrump: Very proud of Arabella and Joseph for their performance in honor of President Xi Jinping and Madame Peng Liyuan's official…
8.50053E+17,4/6/2017 18:30,"It was an honor to host our American heroes from the @WWP #SoldierRideDC at the @WhiteHouse today with @FLOTUS, @VP… https://t.co/u5AI1pupVV"
8.49807E+17,4/6/2017 2:12,"JOBS, JOBS, JOBS!
https://t.co/XGOQPHywrt https://t.co/B5Qbn6llzE"
8.49733E+17,4/5/2017 21:18,I am deeply committed to preserving our strong relationship &amp; to strengthening America's long-standing support for… https://t.co/GxrOR3ALCE
8.49367E+17,4/4/2017 21:03,Great to talk jobs with #NABTU2017. Tremendous spirit &amp; optimism - we will deliver! https://t.co/6lRuQZZHrc
8.49346E+17,4/4/2017 19:38,Thank you Sean McGarvey &amp; the entire Governing Board of Presidents for honoring me w/an invite to speak. #NABTU2017… https://t.co/dJlZvlq6Tj
8.4933E+17,4/4/2017 18:38,".@WhiteHouse #CEOTownHall
➡️https://t.co/ADSKuUXf1b https://t.co/XHfQ6zmF2H"
8.4924E+17,4/4/2017 12:39,RT @DRUDGE_REPORT: RICE ORDERED SPY DOCS ON TRUMP? https://t.co/bL2nZRFxk9
8.48983E+17,4/3/2017 19:39,It was an honor to welcome President Al Sisi of Egypt to the @WhiteHouse as we renew the historic partnership betwe… https://t.co/9mRaGvcPHz
8.48957E+17,4/3/2017 17:56,Looking forward to hosting our heroes from the Wounded Warrior Project (@WWP) Soldier Ride to the @WhiteHouse on Th… https://t.co/QLC0qFD94x
8.48928E+17,4/3/2017 16:00,"Getting ready to meet President al-Sisi of Egypt. On behalf of the United States, I look forward to a long and wonderful relationship."
8.48881E+17,4/3/2017 12:51,".@FoxNews from multiple sources: ""There was electronic surveillance of Trump, and people close to Trump. This is unprecedented."" @FBI"
8.48858E+17,4/3/2017 11:21,Did Hillary Clinton ever apologize for receiving the answers to the debate? Just asking!
8.48857E+17,4/3/2017 11:16,Was the brother of John Podesta paid big money to get the sanctions on Russia lifted? Did Hillary know?
8.48841E+17,4/3/2017 10:15,"Such amazing reporting on unmasking and the crooked scheme against us by @foxandfriends. ""Spied on before nomination."" The real story."
8.48701E+17,4/3/2017 0:58,"Melania and I are honored to light up the @WhiteHouse this evening, for 
#WorldAutismAwarenessDay. Join us &amp; #LIUB.… https://t.co/tR3hqqyWvv"
8.48529E+17,4/2/2017 13:34,The real story turns out to be SURVEILLANCE and LEAKING! Find the leakers.
8.48521E+17,4/2/2017 13:03,"Talks on Repealing and Replacing ObamaCare are, and have been, going on, and will continue until such time as a deal is hopefully struck."
8.4852E+17,4/2/2017 12:56,Anybody (especially  Fake News media) who thinks that Repeal &amp; Replace of ObamaCare is dead does not know the love and strength in R Party!
8.48299E+17,4/1/2017 22:21,Thank you @JCLayfield -- will get even better as my Administration continues to put #AmericaFirst🇺🇸 https://t.co/AQQzmt10x7
8.48219E+17,4/1/2017 17:02,"..not associated with Russia. Trump team spied on before he was nominated."" If this is true, does not get much bigger. Would be sad for U.S."
8.48216E+17,4/1/2017 16:50,"Wow, @FoxNews just reporting big news. Source: ""Official behind unmasking is high up. Known Intel official is responsible. Some unmasked...."
8.48205E+17,4/1/2017 16:06,"...use subsidies to buy health plans."" In other words, Ocare is dead. Good things will happen, however, either with Republicans or Dems."
8.48203E+17,4/1/2017 15:59,"The failing @nytimes finally gets it - ""In places where no insurance company offers plans, there will be no way for ObamaCare customers to.."
8.48159E+17,4/1/2017 13:02,"It is the same Fake News Media that said there is ""no path to victory for Trump"" that is now pushing the phony Russia story. A total scam!"
8.48154E+17,4/1/2017 12:43,When will Sleepy Eyes Chuck Todd and @NBCNews start talking about the Obama SURVEILLANCE SCANDAL and stop with the Fake Trump/Russia story?
8.47924E+17,3/31/2017 21:31,We are going to defend our industry &amp; create a level playing field for the American worker. It is time to put… https://t.co/dzPKJMghj1
8.47896E+17,3/31/2017 19:37,'Trump Celebrates American Manufacturing Survey Showing Highest Level of Optimism in 20 Years' ➡️… https://t.co/cVWXOa1MjY
8.47879E+17,3/31/2017 18:30,"It is an exciting time for our country!
#WeeklyAddress #ConfirmGorsuch https://t.co/tP4bkvTOBq"
8.47867E+17,3/31/2017 17:45,#ConfirmGorsuch #SCOTUS https://t.co/WkqHYMcYa3
8.47863E+17,3/31/2017 17:28,"Great meeting with a wonderful woman today, former Secretary of State, Condoleezza Rice! #USA🇺🇸 https://t.co/ZuriIC3YwG"
8.4782E+17,3/31/2017 14:35,"It was an honor to welcome the Prime Minister of Denmark, Lars Løkke Rasmussen {@larsloekke} to the @WhiteHouse yes… https://t.co/N1g0TiVnSp"
8.47767E+17,3/31/2017 11:04,"Mike Flynn should ask for immunity in that this is a witch hunt (excuse for big election loss), by media &amp; Dems, of historic proportion!"
8.47625E+17,3/31/2017 1:43,Only by enlisting the full potential of women in our society will we be truly able to #MakeAmericaGreatAgain🇺🇸… https://t.co/cxhgYaxiek
8.47573E+17,3/30/2017 22:16,...and job losses. American companies must be prepared to look at other alternatives.
8.47573E+17,3/30/2017 22:16,The meeting next week with China will be a very difficult one in that we can no longer have massive trade deficits...
8.4756E+17,3/30/2017 21:21,"Where are @RepMarkMeadows, @Jim_Jordan and @Raul_Labrador?
#RepealANDReplace #Obamacare"
8.47559E+17,3/30/2017 21:20,"If @RepMarkMeadows, @Jim_Jordan and @Raul_Labrador would get on board we would have both great healthcare and massive tax cuts &amp; reform."
8.47558E+17,3/30/2017 21:17,Great op-ed from @RepKenBuck. Looks like some in the Freedom Caucus are helping me end #Obamacare. https://t.co/Y2vTnIBTBZ
8.47455E+17,3/30/2017 14:27,The failing @nytimes has disgraced the media world. Gotten me wrong for two solid years. Change libel laws? https://t.co/QIqLgvYLLi
8.47435E+17,3/30/2017 13:07,"The Freedom Caucus will hurt the entire Republican agenda if they don't get on the team, &amp; fast. We must fight them, &amp; Dems, in 2018!"
8.4727E+17,3/30/2017 2:12,"Today we honored our true American heroes on the first-ever National Vietnam War Veterans Day.
#ThankAVeteran… https://t.co/deOHapcV4J"
8.47236E+17,3/29/2017 23:58,.@FLOTUS Melania and I were honored to stop by the Women's Empowerment  Panel this afternoon at the @WhiteHouse.… https://t.co/phLPw8lgTu
8.47201E+17,3/29/2017 21:39,Today's EO established a commission on combating drug addiction and the opioid crisis. Watch listening session➡️… https://t.co/ooF2ediqSt
8.47061E+17,3/29/2017 12:21,If the people of our great country could only see how viciously and inaccurately my administration is covered by certain media!
