9.71916E+17,3/9/2018 1:08,"Kim Jong Un talked about denuclearization with the South Korean Representatives, not just a freeze. Also, no missil… https://t.co/ZLg0zRZ976"
9.71872E+17,3/8/2018 22:17,"“Presidential Proclamation on Adjusting Imports of Aluminum into the United States” 
 
Proclamation:… https://t.co/2GahSEcox6"
9.71872E+17,3/8/2018 22:16,"“Presidential Proclamation on Adjusting Imports of Steel into the United States”
 
Proclamation:… https://t.co/hQNfSTdFS2"
9.71823E+17,3/8/2018 18:58,Great meeting with @Cabinet at the @WhiteHouse today! #MAGA https://t.co/InWj0QTosz
9.71813E+17,3/8/2018 18:20,"Happy #InternationalWomensDay

“First Lady Melania Trump to Present the 2018 International Women of Courage Award” https://t.co/EwYtFXGvn2"
9.71727E+17,3/8/2018 12:38,Looking forward to 3:30 P.M. meeting today at the White House. We have to protect &amp; build our Steel and Aluminum In… https://t.co/TOvuYY0vmd
9.7141E+17,3/7/2018 15:38,The U.S. is acting swiftly on Intellectual Property theft. We cannot allow this to happen as it has for many years!
9.71403E+17,3/7/2018 15:10,China has been asked to develop a plan for the year of a One Billion Dollar reduction in their massive Trade Defici… https://t.co/D2TzeyTmqX
9.7135E+17,3/7/2018 11:40,"From Bush 1 to present, our Country has lost more than 55,000 factories, 6,000,000 manufacturing jobs and accumulat… https://t.co/PqL7IA75c4"
9.71346E+17,3/7/2018 11:24,"@MarkBurnettTV @RealRomaDowney From Bush 1 to present, our Country has lost more than 55,000 factories, 6,000,000 m… https://t.co/ZWsYQugFPk"
9.71336E+17,3/7/2018 10:44,"Great couple, great book! https://t.co/cLDI79rin8"
9.71186E+17,3/7/2018 0:49,Will be making a decision soon on the appointment of new Chief Economic Advisor. Many people wanting the job - will choose wisely!
9.71026E+17,3/6/2018 14:11,"Possible progress being made in talks with North Korea. For the first time in many years, a serious effort is being… https://t.co/17I9VFMLrI"
9.71019E+17,3/6/2018 13:46,Federal Judge in Maryland has just ruled that “President Trump has the right to end DACA.” President Obama had 8 ye… https://t.co/Coh1fflMxK
9.71014E+17,3/6/2018 13:25,"Lowest rated Oscars in HISTORY. Problem is, we don’t have Stars anymore - except your President (just kidding, of course)!"
9.71009E+17,3/6/2018 13:07,RT @EricTrump: Congratulations @FoxNews: Fox has 15 of the top 20 shows with @SeanHannity and @TuckerCarlson leading the pack at 1st and 2n…
9.71009E+17,3/6/2018 13:05,We will see what happens! https://t.co/Y1qxoAUfd9
9.71008E+17,3/6/2018 13:02,We are getting it done - jobs and security! https://t.co/Ui8bubj7Yr
9.71008E+17,3/6/2018 13:00,Total inaction on DACA by Dems. Where are you? A deal can be made!
9.71006E+17,3/6/2018 12:55,"The new Fake News narrative is that there is CHAOS in the White House. Wrong! People will always come &amp; go, and I w… https://t.co/gZx40h1psF"
9.7076E+17,3/5/2018 20:37,"It’s March 5th and the Democrats are nowhere to be found on DACA. Gave them 6 months, they just don’t care. Where a… https://t.co/VuCAvyGCb7"
9.70651E+17,3/5/2018 13:22,Why did the Obama Administration start an investigation into the Trump Campaign (with zero proof of wrongdoing) lon… https://t.co/YyfQtgZMpn
9.70644E+17,3/5/2018 12:57,To protect our Country we must protect American Steel! #AMERICA FIRST
9.70628E+17,3/5/2018 11:53,...treat our farmers much better. Highly restrictive. Mexico must do much more on stopping drugs from pouring into… https://t.co/7Bmn1xy747
9.70627E+17,3/5/2018 11:47,"We have large trade deficits with Mexico and Canada. NAFTA, which is under renegotiation right now, has been a bad… https://t.co/SdLj0DaHLu"
9.70451E+17,3/5/2018 0:10,We are on the losing side of almost all trade deals. Our friends and enemies have taken advantage of the U.S. for m… https://t.co/kTZHwXqeMy
9.70354E+17,3/4/2018 17:42,The Gridiron Dinner last night was great fun. I am accomplishing a lot in Washington and have never had a better ti… https://t.co/BZHVReTuYi
9.69994E+17,3/3/2018 17:53,If the E.U. wants to further increase their already massive tariffs and barriers on U.S. companies doing business t… https://t.co/taytTlApWc
9.69992E+17,3/3/2018 17:43,The United States has an $800 Billion Dollar Yearly Trade Deficit because of our “very stupid” trade deals and poli… https://t.co/nFF3vEmRmY
9.69989E+17,3/3/2018 17:33,Mainstream Media in U.S. is being mocked all over the world. They’ve gone CRAZY! https://t.co/4UGYuJpUA7
9.69939E+17,3/3/2018 14:15,Happy National Anthem Day! https://t.co/cf1eugMbKU
9.69661E+17,3/2/2018 19:48,REST IN PEACE BILLY GRAHAM! https://t.co/2qMoUccVC2
9.69572E+17,3/2/2018 13:57,"When a country Taxes our products coming in at, say, 50%, and we Tax the same product coming into our country at ZE… https://t.co/UFVLaWepzN"
9.69558E+17,3/2/2018 13:01,"We must protect our country and our workers. Our steel industry is in bad shape. IF YOU DON’T HAVE STEEL, YOU DON’T HAVE A COUNTRY!"
9.69532E+17,3/2/2018 11:18,"Eric, we are all with you and your family! Look forward to seeing you back on T.V. https://t.co/d6y3Q00BSy"
9.6953E+17,3/2/2018 11:07,"Alec Baldwin, whose dying mediocre career was saved by his terrible impersonation of me on SNL, now says playing me… https://t.co/Ntuy4BRXmJ"
9.69525E+17,3/2/2018 10:50,When a country (USA) is losing many billions of dollars on trade with virtually every country it does business with… https://t.co/lPSkkolNRP
9.69408E+17,3/2/2018 3:04,Good (Great) meeting in the Oval Office tonight with the NRA!
9.69407E+17,3/2/2018 2:59,RT @IvankaTrump: My OpEd on the importance of #YouthSports participation and how this Administration is seeking to lift barriers so all our…
9.69407E+17,3/2/2018 2:58,RT @Scavino45: “Trump Comes Through — Saves $1.4 Billion On New Air Force One” https://t.co/cN3TAQywpR
9.69375E+17,3/2/2018 0:52,Manufacturing growing at the fastest pace in almost two decades!
9.69375E+17,3/2/2018 0:51,Jobless claims at a 49 year low!
9.69324E+17,3/1/2018 21:31,"Together, we will face this challenge as a national family with conviction, with unity, and with a commitment to lo… https://t.co/7sw39LHddj"
9.69312E+17,3/1/2018 20:40,“Consumer Confidence in February Highest Since November 2000” https://t.co/UgAJRawExx
9.69278E+17,3/1/2018 18:26,“Manufacturing in U.S. Expands at Fastest Pace Since May 2004” https://t.co/XZkwS8tTml
9.69273E+17,3/1/2018 18:06,"Unemployment filings are at their lowest level in over 48 years. Great news for workers and JOBS, JOBS, JOBS! #MAGA https://t.co/SzHTarzfrW"
9.69184E+17,3/1/2018 12:12,Our Steel and Aluminum industries (and many others) have been decimated by decades of unfair trade and bad policy w… https://t.co/OEgFJVYtCs
9.69179E+17,3/1/2018 11:53,"Many ideas, some good &amp; some not so good, emerged from our bipartisan meeting on school safety yesterday at the Whi… https://t.co/aJ2m3fH3y3"
9.68963E+17,2/28/2018 21:34,It was an honor to welcome bipartisan members of Congress for a discussion on SAFE schools and SAFE communities. As… https://t.co/EPB1EN3HRc
9.68924E+17,2/28/2018 19:01,"Today we honor Billy Graham as only three private citizens before him have been honored. 

We say a prayer for our… https://t.co/CbrnqFwUuZ"
9.68918E+17,2/28/2018 18:36,"Starting at a small Bible School in Florida, Billy Graham soon led a nationwide revival. From a large tent in Los A… https://t.co/rhhuOssGmf"
9.68896E+17,2/28/2018 17:10,"Today, in the center of this great Chamber lies Billy Graham – an Ambassador for Christ who reminded the world of t… https://t.co/1pVcsV0cam"
9.68857E+17,2/28/2018 14:34,Why is A.G. Jeff Sessions asking the Inspector General to investigate potentially massive FISA abuse. Will take for… https://t.co/3tKywTn98g
9.6885E+17,2/28/2018 14:08,45 year low on illegal border crossings this year. Ice and Border Patrol Agents are doing a great job for our Count… https://t.co/Q6WZdxvUjS
9.68826E+17,2/28/2018 12:29,I have decided that sections of the Wall that California wants built NOW will not be built until the whole Wall is… https://t.co/Vz6U6uS0Za
9.68819E+17,2/28/2018 12:02,"The Heritage Foundation has just stated that 64% of the Trump Agenda is already done, faster than even Ronald Reaga… https://t.co/MxsE3dtLnd"
9.68704E+17,2/28/2018 4:28,Big legal win today. U.S. judge sided with the Trump Administration and rejected the attempt to stop the government… https://t.co/zxoD3cKbaA
9.68702E+17,2/28/2018 4:20,"Such a beautiful map, thank you! https://t.co/FyQdgKvsRO"
9.68621E+17,2/27/2018 22:58,.@SenatorWicker of Mississippi has been a great supporter and incredible help in getting our massive Tax Cut Bill d… https://t.co/NZAavAxY2F
9.68621E+17,2/27/2018 22:55,"Texas LC George P. Bush backed me when it wasn’t the politically correct thing to do, and I back him now. Also, AC… https://t.co/6YdVjdovKe"
9.68551E+17,2/27/2018 18:18,“American consumers are the most confident they've been since 2000....A strong job market is boosting confidence. T… https://t.co/jabPYi1Opc
9.68549E+17,2/27/2018 18:11,"I want to encourage all of my many Texas friends to vote in the primary for Governor Greg Abbott, Senator Ted Cruz,… https://t.co/hhYhBC3fk8"
9.68468E+17,2/27/2018 12:49,WITCH HUNT!
9.68467E+17,2/27/2018 12:45,"“We’ve seen NO EVIDENCE OF COLLUSION....I have seen nothing, the firing of James Comey and all of the aftermath, th… https://t.co/smYiwXrZnh"
9.68463E+17,2/27/2018 12:28,“I’ve been skeptical about the collusion and obstruction claims for the last year. I just don’t see the evidence...… https://t.co/wUxgVpVTIN
9.68456E+17,2/27/2018 11:59,“He’s got a very good point. Somebody in the Justice Department has a treasure trove of evidence of Mrs. Clinton’s… https://t.co/IpmARu0gyP
9.67848E+17,2/25/2018 19:43,RT @WhiteHouse: Merit-based immigration reform will benefit American workers and relieve the strain imposed by our current system on Federa…
9.67609E+17,2/25/2018 3:56,RT @VollrathTammie: @realDonaldTrump @FoxNews https://t.co/sERi7Vyh5I
9.67598E+17,2/25/2018 3:11,"RT @FoxNews: President @realDonaldTrump on Dem FISA memo: ""A lot of bad things happened on the other side, not on this side, but the other…"
9.67598E+17,2/25/2018 3:10,"RT @FoxNews: President @realDonaldTrump on DACA: ""I'm the one that's pushing DACA and the Democrats are nowhere to be found."" https://t.co/…"
9.67565E+17,2/25/2018 1:00,I will be interviewed by @JudgeJeanine on @FoxNews at 9:00 P.M. Enjoy!
9.67564E+17,2/25/2018 0:56,"“Congressman Schiff omitted and distorted key facts” @FoxNews  So, what else is new. He is a total phony!"
9.67546E+17,2/24/2018 23:44,"“Russians had no compromising information on Donald Trump” @FoxNews  Of course not, because there is none, and neve… https://t.co/R9sniNq1ar"
9.6754E+17,2/24/2018 23:20,Dem Memo: FBI did not disclose who the clients were - the Clinton Campaign and the DNC. Wow!
9.67539E+17,2/24/2018 23:16,The Democrat memo response on government surveillance abuses is a total political and legal BUST. Just confirms all… https://t.co/7xFWbPQ5Xh
9.67526E+17,2/24/2018 22:26,BIG CPAC STRAW POLL RESULTS: 93% APPROVE OF THE JOB PRESIDENT TRUMP IS DOING (Thank you!). 50% say President Trump… https://t.co/QavF7yVap4
9.67509E+17,2/24/2018 21:18,"Dems are no longer talking DACA! “Out of sight, out of mind,” they say. DACA beneficiaries should not be happy. Nan… https://t.co/TZjolh9nkE"
9.67506E+17,2/24/2018 21:07,Unemployment claims are at the lowest level since 1973. Much of this has to do with the massive cutting of unnecess… https://t.co/3W7uDjmtZJ
9.67493E+17,2/24/2018 20:16,Democrat judges have totally redrawn election lines in the great State of Pennsylvania. @FoxNews. This is very unfa… https://t.co/uErhBXPwuM
9.67473E+17,2/24/2018 18:54,Armed Educators (and trusted people who work within a school) love our students and will protect them. Very smart p… https://t.co/wQSlkyUTzh
9.6739E+17,2/24/2018 13:23,RT @realDonaldTrump: I will be strongly pushing Comprehensive Background Checks with an emphasis on Mental Health. Raise age to 21 and end…
9.67389E+17,2/24/2018 13:21,"So true Wayne, and Lowest black unemployment in history! https://t.co/gDxxJdZQUm"
9.67169E+17,2/23/2018 22:46,Thank you to the great men and women of the United States @SecretService for a job well done!
9.67147E+17,2/23/2018 21:19,"Today, @FLOTUS Melania and I were honored to welcome Prime Minister @TurnbullMalcolm and Mrs. Turnbull of Australia… https://t.co/PeVPje9xba"
9.67085E+17,2/23/2018 17:12,"Our nation’s motto is IN GOD WE TRUST. This week, our nation lost an incredible leader who devoted his life to help… https://t.co/gQzYg1Xq8r"
9.67084E+17,2/23/2018 17:08,"We salute our great American flag, we put our hands on our hearts for the pledge of Allegiance, and we all PROUDLY… https://t.co/BoR8a2Kn29"
9.67083E+17,2/23/2018 17:06,"After years of rebuilding OTHER nations, we are finally rebuilding OUR nation - and we are restoring our confidence… https://t.co/LXqvjEMR5D"
9.67024E+17,2/23/2018 13:09,"For those of you who are still interested, the Democrats have totally forgotten about DACA. Not a lot of interest on this subject from them!"
9.67023E+17,2/23/2018 13:07,"My daughter, Ivanka, just arrived in South Korea. We cannot have a better, or smarter, person representing our country."
9.67022E+17,2/23/2018 13:01,CPAC Today!
9.66998E+17,2/23/2018 11:28,"MS-13 gang members are being removed by our Great ICE and Border Patrol Agents by the thousands, but these killers… https://t.co/ktMXRRb97k"
9.66847E+17,2/23/2018 1:26,“School shooting survivor says he quit @CNN Town Hall after refusing scripted question.” @TuckerCarlson. Just like… https://t.co/wDQm1urt9V
9.66766E+17,2/22/2018 20:07,"Today, it was my great honor to host a School Safety Roundtable at the @WhiteHouse with State and local leaders, la… https://t.co/BtEV9OqmNJ"
9.66712E+17,2/22/2018 16:29,"On behalf of an entire Nation, CONGRATULATIONS to the U.S. Women's Hockey Team on winning the GOLD! #GoTeamUSA… https://t.co/1dpsf8yqdq"
9.66687E+17,2/22/2018 14:53,Will be meeting with Lawmakers today at 11:30 A.M. to discuss School Safety.  Next week it will be with our Nation’… https://t.co/USyL5x0ujR
9.66682E+17,2/22/2018 14:31,"What many people don’t understand, or don’t want to understand, is that Wayne, Chris and the folks who work so hard… https://t.co/4I87uxDsqD"
9.66662E+17,2/22/2018 13:13,I will be strongly pushing Comprehensive Background Checks with an emphasis on Mental Health. Raise age to 21 and e… https://t.co/5zKlGxnVTc
9.6666E+17,2/22/2018 13:05,....If a potential “sicko shooter” knows that a school has a large number of very weapons talented teachers (and ot… https://t.co/NTnUcZxrle
9.66657E+17,2/22/2018 12:54,"....History shows that a school shooting lasts, on average, 3 minutes. It takes police &amp; first responders approxima… https://t.co/v68k63he25"
9.66654E+17,2/22/2018 12:40,....immediately fire back if a savage sicko came to a school with bad intentions. Highly trained teachers would als… https://t.co/wyg77QWPfn
9.6665E+17,2/22/2018 12:26,I never said “give teachers guns” like was stated on Fake News @CNN &amp; @NBC. What I said was to look at the possibil… https://t.co/Tvi4fzLbCA
9.66488E+17,2/22/2018 1:40,"I will always remember the time I spent today with courageous students, teachers and families. So much love in the… https://t.co/u8ZYPzhp2S"
9.6642E+17,2/21/2018 21:12,.@FLOTUS Melania and I join millions of people around the world in mourning the passing of Billy Graham. Our prayer… https://t.co/Q8BrGTiHuP
9.66377E+17,2/21/2018 18:20,"Yesterday, it was my great honor to recognize extraordinary Law Enforcement Officers and First Responders, and to a… https://t.co/PsfNaJrfEB"
9.66322E+17,2/21/2018 14:40,"Question: If all of the Russian meddling took place during the Obama Administration, right up to January 20th, why… https://t.co/dquN8v8VwU"
9.66317E+17,2/21/2018 14:22,The GREAT Billy Graham is dead. There was nobody like him! He will be missed by Christians and all religions. A very special man.
9.6612E+17,2/21/2018 1:18,"@CNN @MSNBC Whether we are Republican or Democrat, we must now focus on strengthening Background Checks!"
9.66119E+17,2/21/2018 1:14,"So true, thank you! https://t.co/9TTXlfokYz"
9.66117E+17,2/21/2018 1:08,Bad ratings @CNN &amp; @MSNBC got scammed when they covered the anti-Trump Russia rally wall-to-wall. They probably kne… https://t.co/1s5PQaBe2g
9.66007E+17,2/20/2018 17:49,"Main Street is BOOMING thanks to our incredible TAX CUT and Reform law. ""This shows small-business owners are more… https://t.co/gkJczuVCt6"
9.65972E+17,2/20/2018 15:29,....cameras running. Another False Accusation. Why doesn’t @washingtonpost report the story of the women taking mon… https://t.co/OTpK1KLYOL
9.65968E+17,2/20/2018 15:16,"A woman I don’t know and, to the best of my knowledge, never met, is on the FRONT PAGE of the Fake News Washington… https://t.co/lWlDMu6gxb"
9.65944E+17,2/20/2018 13:38,"I have been much tougher on Russia than Obama, just look at the facts. Total Fake News!"
9.65937E+17,2/20/2018 13:11,"Hope Republicans in the Great State of Pennsylvania challenge the new “pushed” Congressional Map, all the way to th… https://t.co/bT190oQKpM"
9.65935E+17,2/20/2018 13:03,Matt Schlapp and CPAC are getting ready for another exciting event. Big difference from those days when President O… https://t.co/KxKVJL0Bc4
9.65933E+17,2/20/2018 12:54,"Republicans are now leading the Generic Poll, perhaps because of the popular Tax Cuts which the Dems want to take a… https://t.co/TQfyR96KP8"
9.65931E+17,2/20/2018 12:46,....The President Obama quote just before election. That’s because he thought Crooked Hillary was going to win and… https://t.co/59Wli8q1pN
9.65928E+17,2/20/2018 12:37,"“There is no serious person out there who would suggest somehow that you could even rig America’s elections, there’… https://t.co/eJ9M6A2H50"
9.65925E+17,2/20/2018 12:24,Thank you to @foxandfriends for the great timeline on all of the failures the Obama Administration had against Russ… https://t.co/SI7CxX4a7C
9.6578E+17,2/20/2018 2:48,"“The Faith of Donald Trump,” a book just out by David Brody and Scott Lamb, is a very interesting read. Enjoy!"
9.65775E+17,2/20/2018 2:29,"The U.S. economy is looking very good, in my opinion, even better than anticipated. Companies are pouring back into… https://t.co/Sxweprvk7N"
9.65773E+17,2/20/2018 2:21,.@MittRomney has announced he is running for the Senate from the wonderful State of Utah. He will make a great Sena… https://t.co/h1RaVb2OVj
9.65676E+17,2/19/2018 19:55,"Obama was President up to, and beyond, the 2016 Election. So why didn’t he do something about Russian meddling?"
9.65582E+17,2/19/2018 13:42,"Have a great, but very reflective, President’s Day!"
9.65443E+17,2/19/2018 4:28,"Just watched a very insecure Oprah Winfrey, who at one point I knew very well, interview a panel of people on 60 Mi… https://t.co/7iuf59562i"
9.65303E+17,2/18/2018 19:13,"My great friends from NASCAR are having their big race today, The Daytona 500. Brian France and the France family a… https://t.co/EWBOQxPW2S"
9.65272E+17,2/18/2018 17:10,"Thank you to KenStarr, former Independent Counsel, Whitewater, for your insight and powerful words on FISA abuse, R… https://t.co/XGIgUkn3qK"
9.65223E+17,2/18/2018 13:55,Great Pollster John McLaughlin now has the GOP up in the Generic Congressional Ballot. Big gain over last 4 weeks.… https://t.co/iIrNmfPgbQ
9.65221E+17,2/18/2018 13:46,The Fake News of big ratings loser CNN. https://t.co/rYsv90cnvs
9.65212E+17,2/18/2018 13:11,"If it was the GOAL of Russia to create discord, disruption and chaos within the U.S. then, with all of the Committe… https://t.co/fx3CPabzTi"
9.65208E+17,2/18/2018 12:53,"RT @mike_pence: Big night. Largest-ever Dallas County GOP Reagan Day Dinner. As I told the crowd, under President @realDonaldTrump: Promise…"
9.65205E+17,2/18/2018 12:43,"Now that Adam Schiff is starting to blame President Obama for Russian meddling in the election, he is probably doin… https://t.co/R2OTHSUYP9"
9.65203E+17,2/18/2018 12:33,"I never said Russia did not meddle in the election, I said “it may be Russia, or China or another country or group,… https://t.co/1dMjQbLlSC"
9.652E+17,2/18/2018 12:22,"Finally, Liddle’ Adam Schiff, the leakin’ monster of no control, is now blaming the Obama Administration for Russia… https://t.co/9HNsbaWwWj"
9.65195E+17,2/18/2018 12:02,"Never gotten over the fact that Obama was able to send $1.7 Billion Dollars in CASH to Iran and nobody in Congress,… https://t.co/5nQ35ANIrg"
9.65079E+17,2/18/2018 4:22,General McMaster forgot to say that the results of the 2016 election were not impacted or changed by the Russians a… https://t.co/ilaHKwf6Jy
9.65076E+17,2/18/2018 4:08,Very sad that the FBI missed all of the many signals sent out by the Florida school shooter. This is not acceptable… https://t.co/yvvTEmad2e
9.65009E+17,2/17/2018 23:45,"Just like they don’t want to solve the DACA problem, why didn’t the Democrats pass gun control legislation when the… https://t.co/c2gS0ByFUw"
9.64957E+17,2/17/2018 20:16,“I have seen all of the Russian ads and I can say very definitively that swaying the election was *NOT* the main go… https://t.co/y4PVZ6KZqv
9.64955E+17,2/17/2018 20:11,"The Fake News Media never fails. Hard to ignore this fact from the Vice President of Facebook Ads, Rob Goldman! https://t.co/XGC7ynZwYJ"
9.64949E+17,2/17/2018 19:46,"Funny how the Fake News Media doesn’t want to say that the Russian group was formed in 2014, long before my run for… https://t.co/9BPo5EB5WN"
9.64947E+17,2/17/2018 19:36,Deputy A.G. Rod Rosenstein stated at the News Conference: “There is no allegation in the indictment that any Americ… https://t.co/pPhsPl34Ie
9.64944E+17,2/17/2018 19:26,"“Charges Deal Don A Big Win,” written by Michael Goodwin of the @nypost, succinctly states that “the Russians had n… https://t.co/yoFUA9PolC"
9.64939E+17,2/17/2018 19:04,"Melania and I met such incredible people last night in Broward County, Florida. Will never forget them, or the evening!"
9.64724E+17,2/17/2018 4:53,"Our entire Nation, w/one heavy heart, continues to pray for the victims &amp; their families in Parkland, FL. To teache… https://t.co/jR8THlLD5z"
9.64595E+17,2/16/2018 20:18,"Russia started their anti-US campaign in 2014, long before I announced that I would run for President. The results… https://t.co/B4D7ZcKHPp"
9.64512E+17,2/16/2018 14:49,Cannot believe how BADLY DACA recipients have been treated by the Democrats...totally abandoned! Republicans are still working hard.
9.64509E+17,2/16/2018 14:37,I will be leaving for Florida today to meet with some of the bravest people on earth - but people whose lives have… https://t.co/1APUFLwj1f
9.64233E+17,2/15/2018 20:19,"Presidential Proclamation Honoring the Victims of the Tragedy in Parkland, Florida: https://t.co/RTQWAKiSnR https://t.co/Nhs32bm5zB"
9.64219E+17,2/15/2018 19:26,"...lottery, continues deadly catch-and-release, and bars enforcement even for FUTURE illegal immigrants. Voting for… https://t.co/ruP4vp9vxa"
9.64219E+17,2/15/2018 19:25,The Schumer-Rounds-Collins immigration bill would be a total catastrophe. @DHSgov says it would be “the end of immi… https://t.co/FegRjpmNZj
9.64218E+17,2/15/2018 19:22,"RT @SpoxDHS: Schumer-Rounds-Collins destroys the ability of @DHSgov to enforce immigration laws, creating a mass amnesty for over 10 millio…"
9.64191E+17,2/15/2018 17:33,"In times of tragedy, the bonds that sustain us are those of family, faith, community, and country. These bonds are… https://t.co/LraxXxUN3D"
9.64152E+17,2/15/2018 14:57,"While the Republicans and Democrats in Congress are working hard to come up with a solution to DACA, they should be… https://t.co/qti7gQGh0I"
9.6411E+17,2/15/2018 12:12,"So many signs that the Florida shooter was mentally disturbed, even expelled from school for bad and erratic behavi… https://t.co/3mSYrtTng6"
9.63879E+17,2/14/2018 20:55,Just spoke to Governor Rick Scott. We are working closely with law enforcement on the terrible Florida school shooting.
9.63878E+17,2/14/2018 20:50,"My prayers and condolences to the families of the victims of the terrible Florida shooting. No child, teacher or an… https://t.co/RFJxgM1jhm"
9.63853E+17,2/14/2018 19:11,"Today, I was honored to be joined by Republicans and Democrats from both the House and Senate, as well as members o… https://t.co/38kUIIV8Cp"
9.63839E+17,2/14/2018 18:15,"As we come together to celebrate the extraordinary contributions of African-Americans to our nation, our thoughts t… https://t.co/SwAJxO88zC"
9.63365E+17,2/13/2018 10:52,Negotiations on DACA have begun. Republicans want to make a deal and Democrats say they want to make a deal. Wouldn… https://t.co/YW4mCpHr0R
9.63363E+17,2/13/2018 10:43,"Our infrastructure plan has been put forward and has received great reviews by everyone except, of course, the Demo… https://t.co/2EfB9sObdN"
9.63153E+17,2/12/2018 20:48,The journey to #MAGA began @CPAC 2011 and the opportunity to reconnect with friends and supporters is something I l… https://t.co/DSz3Szp4xE
9.63034E+17,2/12/2018 12:54,"Thank you to Sue Kruczek, who lost her wonderful and talented son Nick to the Opioid scourge, for your kind words w… https://t.co/0kIdepXBdi"
9.63032E+17,2/12/2018 12:46,"This will be a big week for Infrastructure. After so stupidly spending $7 trillion in the Middle East, it is now ti… https://t.co/OcX7UN18Er"
